{"$schema":"https://json-schema.org/draft/2020-12/schema","title":"Education source profiles; not course records","type":"object","required":["schema_version","compiled_at","count","description","sources"],"additionalProperties":false,"properties":{"schema_version":{"const":"1.0.0"},"compiled_at":{"type":"string","format":"date"},"count":{"type":"integer","minimum":0},"description":{"type":"string"},"sources":{"type":"array","items":{"type":"object","required":["id","name","scope","integration_notes","caveats","url","role","access_mode","formats","reuse_status","license_label","license_evidence_url","useful_for","azav_role","evidence_urls","documentation_checked_at","payload_checked_at"],"properties":{"id":{"type":"string","pattern":"^edu-[a-z0-9-]+$"},"name":{"type":"string","minLength":1},"scope":{"type":"string","minLength":1},"integration_notes":{"type":"string","minLength":1},"caveats":{"type":"string","minLength":1},"url":{"type":"string","format":"uri","pattern":"^https://"},"role":{"enum":["offer_search","provider_interface","open_offer_dataset","learning_metadata","skills_taxonomy","approval_reference"]},"access_mode":{"enum":["public_search","account_scoped_exchange","bulk_documented","bulk_and_sparql_documented","api_and_bulk_documented","reference_only"]},"formats":{"type":"array","minItems":1,"uniqueItems":true,"items":{"type":"string","minLength":1}},"reuse_status":{"enum":["not_established","own_data_only","open_license_indicated","dataset_specific_review"]},"license_label":{"type":["string","null"]},"license_evidence_url":{"anyOf":[{"type":"string","format":"uri","pattern":"^https://"},{"type":"null"}]},"useful_for":{"type":"array","minItems":1,"items":{"type":"string","minLength":1}},"azav_role":{"enum":["discovery_only","not_established","not_applicable","approval_rules","issuer_verification"]},"evidence_urls":{"type":"array","minItems":1,"uniqueItems":true,"items":{"type":"string","format":"uri","pattern":"^https://"}},"documentation_checked_at":{"type":"string","format":"date"},"payload_checked_at":{"anyOf":[{"type":"string","format":"date"},{"type":"null"}]}},"additionalProperties":false,"allOf":[{"if":{"properties":{"reuse_status":{"const":"open_license_indicated"}}},"then":{"properties":{"license_label":{"type":"string","minLength":1},"license_evidence_url":{"type":"string","format":"uri","pattern":"^https://"}}}}]}}}}
