{"schema_version":"1.0.0","compiled_at":"2026-10-22","count":11,"description":"Quellenprofile, keine importierten Kursdaten. Dokumentationspruefung ist kein API- oder Lizenzfreigabetest.","sources":[{"id":"edu-mein-now","name":"mein NOW","url":"https://mein-now.de/privatpersonen/weiterbildungen","scope":"DE","role":"offer_search","access_mode":"public_search","formats":["HTML"],"reuse_status":"not_established","license_label":null,"license_evidence_url":null,"integration_notes":"Websuche und Originalverlinkung; keine offene Abruf-API nachgewiesen.","useful_for":["Kursvergleich","Umschulungssuche"],"azav_role":"discovery_only","caveats":"Kurseintrag und Foerderhinweis sind kein geprueftes Massnahmezertifikat.","evidence_urls":["https://mein-now.de/privatpersonen/weiterbildungen","https://www.arbeitsagentur.de/karriere-und-weiterbildung/nationales-onlineportal-berufliche-weiterbildung-mein-now"],"documentation_checked_at":"2026-10-22","payload_checked_at":null},{"id":"edu-kursnet-openqcat","name":"KURSNET / open-Qcat","url":"https://www.arbeitsagentur.de/institutionen/kurse-anbieten/xml-upload","scope":"DE","role":"provider_interface","access_mode":"account_scoped_exchange","formats":["XML"],"reuse_status":"own_data_only","license_label":null,"license_evidence_url":null,"integration_notes":"Import und Export eigener Angebotsdaten im Anbieter-Konto; kein Gesamtdump.","useful_for":["Anbieterfeed","Datenpflege"],"azav_role":"discovery_only","caveats":"XML-Upload ist keine oeffentliche Lese-API; fremde Angebote sind nicht freigegeben.","evidence_urls":["https://www.arbeitsagentur.de/institutionen/kurse-anbieten/xml-upload"],"documentation_checked_at":"2026-10-22","payload_checked_at":null},{"id":"edu-iwwb","name":"InfoWeb Weiterbildung (IWWB)","url":"https://www.iwwb.de/information/UEber-das-IWWB-weiterbildung-20.html","scope":"DE","role":"offer_search","access_mode":"public_search","formats":["HTML"],"reuse_status":"not_established","license_label":null,"license_evidence_url":null,"integration_notes":"Meta-Suche zur Entdeckung von Quellen; Partnerschnittstellen nicht als offene API behandeln.","useful_for":["Quellenrecherche","Abdeckungsanalyse"],"azav_role":"discovery_only","caveats":"Cache und Schnittstellen der Partner belegen keine allgemeine Weiterverwendungserlaubnis.","evidence_urls":["https://www.iwwb.de/information/UEber-das-IWWB-weiterbildung-20.html"],"documentation_checked_at":"2026-10-22","payload_checked_at":null},{"id":"edu-berlin-vhs","name":"Kurse der Berliner Volkshochschulen","url":"https://daten.berlin.de/datensaetze/kurse","scope":"DE-BE","role":"open_offer_dataset","access_mode":"bulk_documented","formats":["JSON","XML"],"reuse_status":"open_license_indicated","license_label":"CC BY; Version in Metadaten nicht eindeutig","license_evidence_url":"https://daten.berlin.de/datensaetze/kurse","integration_notes":"Offizielle Ressourcenlinks aufloesen, Payload und Lizenzversion pruefen, dann normalisieren.","useful_for":["Kursdaten-Pilot","Regionale Weiterbildung"],"azav_role":"not_established","caveats":"Aktualisierungsangaben widersprechen sich: stuendlich im Katalog, montags bei Ressourcen. Keine AZAV-Gesamtliste.","evidence_urls":["https://daten.berlin.de/datensaetze/kurse"],"documentation_checked_at":"2026-10-22","payload_checked_at":null},{"id":"edu-europass-qdr","name":"Europass / European Learning Data","url":"https://data.europa.eu/data/datasets/european-learning-data?locale=en","scope":"EU; DE teilweise","role":"learning_metadata","access_mode":"bulk_and_sparql_documented","formats":["TTL","JSON-LD"],"reuse_status":"dataset_specific_review","license_label":null,"license_evidence_url":"https://europass.europa.eu/en/news/data-qualifications-and-learning-opportunities-now-available-open-data-portal","integration_notes":"Laender-Distribution und ELM-Version auswaehlen; Lizenz und deutsche Abdeckung separat pruefen.","useful_for":["Lernangebotsvergleich","Internationale Bildungsdaten"],"azav_role":"not_established","caveats":"Deutsche KURSNET-Uebertragung umfasst laut Einwilligung nur bestimmte Kategorien und ist zustimmungsabhaengig.","evidence_urls":["https://europass.europa.eu/en/news/data-qualifications-and-learning-opportunities-now-available-open-data-portal","https://www.kursnet-online.arbeitsagentur.de/onlinekurs/printEinwilligungEuropass.do"],"documentation_checked_at":"2026-10-22","payload_checked_at":null},{"id":"edu-hamburg-wisy","name":"Hamburger Kursportal WISY","url":"https://hamburg.kursportal.info/","scope":"DE-HH und ergaenzende Fernangebote","role":"offer_search","access_mode":"public_search","formats":["HTML"],"reuse_status":"open_license_indicated","license_label":"CC BY-SA 3.0 DE fuer eingestellte Kursdatensaetze","license_evidence_url":"https://hamburg.kursportal.info/g679","integration_notes":"Lizenzumfang des konkreten Bestands und technischen Exportweg pruefen; keine offene Bulk-API bestaetigt.","useful_for":["Bildungsgutschein-Suche","Regionaler Kursvergleich"],"azav_role":"discovery_only","caveats":"Share-Alike beachten; kein pauschaler Lizenznachweis fuer importierte Drittbestaende oder gesamte Website.","evidence_urls":["https://hamburg.kursportal.info/","https://bildungsgutschein.kursportal.info/","https://hamburg.kursportal.info/g679","https://creativecommons.org/licenses/by-sa/3.0/de/"],"documentation_checked_at":"2026-10-22","payload_checked_at":null},{"id":"edu-wis-ihk","name":"Weiterbildungs-Informations-System WIS","url":"https://wis.ihk.de/","scope":"DE","role":"offer_search","access_mode":"public_search","formats":["HTML"],"reuse_status":"not_established","license_label":null,"license_evidence_url":null,"integration_notes":"Recherche und Verlinkung; Datenuebernahme erst mit belegten Rechten.","useful_for":["IHK-Weiterbildung","Seminarvergleich"],"azav_role":"not_established","caveats":"IHK-Bezug ist kein Nachweis einer AZAV-Massnahmezulassung.","evidence_urls":["https://www.ihk.de/hagen/bildung/weiterbildung/weiterbildungs-informations-system-3174488","https://www.dihk-bildungs-gmbh.de/seminare/"],"documentation_checked_at":"2026-10-22","payload_checked_at":null},{"id":"edu-hoch-und-weit","name":"hoch & weit","url":"https://hoch-und-weit.de/","scope":"DE","role":"offer_search","access_mode":"public_search","formats":["HTML"],"reuse_status":"not_established","license_label":null,"license_evidence_url":null,"integration_notes":"Hochschulangebote per Filter vergleichen; offene Drittnutzer-API nicht nachgewiesen.","useful_for":["Hochschulzertifikate","Berufsbegleitende Weiterbildung"],"azav_role":"not_established","caveats":"Hochschulstatus und ECTS ersetzen keine AZAV-Pruefung.","evidence_urls":["https://hoch-und-weit.de/faq/"],"documentation_checked_at":"2026-10-22","payload_checked_at":null},{"id":"edu-esco","name":"ESCO","url":"https://esco.ec.europa.eu/de/use-esco/download","scope":"EU; mehrsprachig","role":"skills_taxonomy","access_mode":"api_and_bulk_documented","formats":["CSV","ODS","TTL"],"reuse_status":"dataset_specific_review","license_label":null,"license_evidence_url":null,"integration_notes":"Versionierte Begriffs-URIs fuer Beruf-Kompetenz-Kurs-Mapping; Daten- und Softwarelizenz trennen.","useful_for":["Skill-Matching","Synonymnormalisierung"],"azav_role":"not_applicable","caveats":"Keine Kursdatenbank und kein Foerder- oder AZAV-Nachweis.","evidence_urls":["https://esco.ec.europa.eu/de/use-esco/download","https://esco.ec.europa.eu/en/use-esco/use-esco-services-api/esco-local-api"],"documentation_checked_at":"2026-10-22","payload_checked_at":null},{"id":"edu-ba-azav","name":"BA: Akkreditierung und Zulassung","url":"https://www.arbeitsagentur.de/institutionen/bildungstraeger/akkreditierung-zulassung","scope":"DE","role":"approval_reference","access_mode":"reference_only","formats":["HTML"],"reuse_status":"not_established","license_label":null,"license_evidence_url":null,"integration_notes":"Anforderungen und Pruefregeln dokumentieren; keine Kursliste importieren.","useful_for":["Nachweispruefung","Fachliche Regeln"],"azav_role":"approval_rules","caveats":"Traegerzulassung, Massnahmezulassung und individuelle Foerderung getrennt erfassen.","evidence_urls":["https://www.arbeitsagentur.de/institutionen/bildungstraeger/akkreditierung-zulassung"],"documentation_checked_at":"2026-10-22","payload_checked_at":null},{"id":"edu-dakks-azav","name":"DAkkS: Fachkundige Stellen AZAV","url":"https://www.dakks.de/de/azav.html","scope":"DE","role":"approval_reference","access_mode":"reference_only","formats":["HTML"],"reuse_status":"not_established","license_label":null,"license_evidence_url":null,"integration_notes":"Akkreditierung und Geltungsbereich der ausstellenden Stelle recherchieren.","useful_for":["Ausstellerpruefung","Nachweisvalidierung"],"azav_role":"issuer_verification","caveats":"Verzeichnis fachkundiger Stellen, kein Register aller zugelassenen Bildungstraeger oder Kurse.","evidence_urls":["https://www.dakks.de/de/azav.html"],"documentation_checked_at":"2026-10-22","payload_checked_at":null}]}
